{
  "$schema": "http://json-schema.org/draft-07/schema#",
  "$id": "https://projectforge.dev/schemas/project.schema.json",
  "title": "Project",
  "type": "object",
  "properties": {
    "key": {
      "description": "the id of this project, globally unique",
      "type": "string"
    },
    "name": {
      "description": "the human-readable name of this project",
      "type": "string"
    },
    "icon": {
      "description": "one of the SVGs available in ./assets",
      "type": "string"
    },
    "exec": {
      "description": "executable name for this project",
      "type": "string"
    },
    "version": {
      "description": "semver version string",
      "type": "string"
    },
    "package": {
      "description": "full package for this project's module",
      "type": "string"
    },
    "args": {
      "description": "additional arguments to pass when starting this project",
      "type": "string"
    },
    "port": {
      "description": "http port for this project",
      "type": "integer"
    },
    "modules": {
      "description": "the modules used by this project",
      "type": "array",
      "items": {
        "type": "string"
      }
    },
    "ignore": {
      "description": "file patterns to ignore in git and Docker",
      "type": "array",
      "items": {
        "type": "string"
      }
    },
    "tags": {
      "description": "flags for sorting and filtering projects",
      "type": "array",
      "items": {
        "type": "string"
      }
    },
    "info": {
      "description": "additional info about this project",
      "$ref": "info.schema.json#/"
    },
    "theme": {
      "description": "default theme definition for this project",
      "$ref": "theme.schema.json#/"
    },
    "build": {
      "description": "build options for this project",
      "$ref": "build.schema.json#/"
    }
  },
  "additionalProperties": false,
  "required": [
    "key",
    "name",
    "version",
    "package"
  ]
}
